{
  "_comment": "TEMPLATE ONLY. Copy to union-city-nj.rates.json and fill in Marco Design's real figures. The real .rates.json files are git-ignored and never committed (kickoff section 9: rate card is proprietary). For an 'estimated' town set baseline+factor and single per-tier rates. For a 'verified' town set baseline+factor to null and give each tier a rate_per_sqft {min, max} range plus client-facing notes.",
  "slug": "union-city-nj",
  "provenance": "estimated",
  "regional_baseline_per_sqft": 0.00,
  "local_cost_factor": 1.00,
  "tiers": {
    "essential": {
      "rate_per_sqft": 0.00,
      "formula_reference": "regional_baseline * local_factor * 0.75"
    },
    "signature": {
      "rate_per_sqft": 0.00,
      "formula_reference": "regional_baseline * local_factor"
    },
    "premium": {
      "rate_per_sqft": 0.00,
      "formula_reference": "regional_baseline * local_factor * 1.40"
    }
  }
}
